{
  "claim_id": "claim_circadian_morning_light",
  "schema_version": "0.1.1",
  "statement": "Synthetic evidence fixture only: no light-exposure routine has been admitted for user-facing guidance.",
  "evidence_tier": "E",
  "certainty": "low",
  "pico": {
    "population": "Synthetic fixture; no population has been admitted.",
    "intervention": "Not specified; no intervention has been admitted.",
    "comparator": "Not specified for this discovery-only fixture.",
    "outcome": "No user-facing outcome has been admitted.",
    "timeframe": "Not specified for this discovery-only fixture."
  },
  "harms": {
    "summary": "Not assessed; this synthetic fixture cannot support action.",
    "certainty": "uncertain"
  },
  "directness": "unclear",
  "funding_coi": {
    "funding": "Not reviewed for admission.",
    "coi_status": "unknown"
  },
  "integrity": {
    "status": "unverified",
    "correction_status": "not_checked",
    "supersession_status": "not_checked",
    "reviewed_on": "2026-08-24",
    "next_review_due": "2026-08-24"
  },
  "rights": {
    "ingestion_mode": "metadata_only",
    "license_review_status": "pending"
  },
  "sources": [
    {
      "source_id": "src_aasm_healthy_sleep_habits",
      "title": "American Academy of Sleep Medicine — healthy sleep habits (public education)",
      "kind": "authority_education",
      "publisher_or_authority": "American Academy of Sleep Medicine",
      "url": "https://sleepeducation.org/healthy-sleep/healthy-sleep-habits/",
      "year": 2023,
      "license": "authority_site_terms",
      "use_permission": "metadata_only",
      "retrieved_on": "2026-08-10",
      "reviewed_on": "2026-08-24",
      "correction_status": "none_found",
      "correction_checked_on": "2026-08-24",
      "notes": "Public education on consistent schedule and light/dark cues; not a personal prescription."
    },
    {
      "source_id": "src_nhlbi_healthy_sleep_guide",
      "title": "NIH / NHLBI — Your Guide to Healthy Sleep (light and routine themes)",
      "kind": "authority_education",
      "publisher_or_authority": "National Heart, Lung, and Blood Institute",
      "url": "https://www.nhlbi.nih.gov/resources/your-guide-healthy-sleep",
      "year": 2011,
      "license": "authority_site_terms",
      "use_permission": "metadata_only",
      "retrieved_on": "2026-08-10",
      "reviewed_on": "2026-08-24",
      "correction_status": "none_found",
      "correction_checked_on": "2026-08-24",
      "notes": "Foundational public guidance; verify local clinician advice for disorders."
    }
  ],
  "domain_pack": "circadian",
  "population": "General-wellness adults without clinician-directed light restrictions.",
  "last_reviewed": "2026-08-24",
  "status": "draft",
  "admission": {
    "user_facing_allowed": false,
    "evidence_review_complete": false,
    "license_review_complete": false,
    "correction_check_complete": false,
    "harms_review_complete": false,
    "funding_coi_review_complete": false,
    "integrity_review_complete": false,
    "directness_review_complete": false
  },
  "conflict_flag": false,
  "applicability": "Not applicable to a person. This draft exists only to exercise evidence and safety validation.",
  "limitations": ["Public education sources do not establish a precise duration for every person.", "Light-sensitive conditions require qualified guidance."],
  "conflicts": { "status": "not_applicable", "notes": "Public authority education sources; source-specific disclosures still require review." },
  "not_a_personal_prescription": true
}
